{
  "$id": "https://musi-lang.org/schemas/mspackage-schema.v1.json",
  "$schema": "https://json-schema.org/draft/2020-12/schema",
  "title": "Musi package configuration file Schema",
  "description": "A JSON representation of a Musi package configuration file (mspackage.json).",
  "type": "object",
  "required": [],
  "properties": {
    "name": {
      "type": "string",
      "description": "The name of this MSR package.",
      "pattern": "^(@[a-z0-9-~][a-z0-9-._~]*/)?[a-z0-9-~][a-z0-9-._~]*$"
    },
    "version": {
      "type": "string",
      "description": "The version of this MSR package.",
      "pattern": "^[0-9]+\\.[0-9]+\\.[0-9]+(-[a-zA-Z0-9-]+)?(\\+[a-zA-Z0-9-]+)?$"
    },
    "description": {
      "type": "string",
      "description": "A brief description of the package."
    },
    "main": {
      "type": "string",
      "description": "The main entry point of the package.",
      "pattern": "^\\./.*\\.ms$",
      "default": "./index.ms"
    },
    "exports": {
      "oneOf": [
        {
          "type": "string",
          "description": "The path to the main module of this MSR package.",
          "examples": [
            "./index.ms",
            "./mod.ms"
          ],
          "pattern": "^\\./.*\\.ms$"
        },
        {
          "type": "object",
          "description": "A map of package exports to files in this MSR package.",
          "propertyNames": {
            "description": "Package export name",
            "examples": [
              ".",
              "./utils",
              "./math"
            ],
            "pattern": "^\\.(/.*)?"
          },
          "patternProperties": {
            "^\\.(/.*)": {
              "type": "string",
              "pattern": "^\\./.*\\.ms$"
            }
          },
          "examples": [
            {
              ".": "./index.ms",
              "./utils": "./src/utils.ms"
            }
          ]
        }
      ]
    },
    "imports": {
      "description": "A map of specifiers to their remapped specifiers.",
      "type": "object",
      "additionalProperties": {
        "description": "The key is the specifier or partial specifier to match, with a value that represents the target specifier.",
        "type": "string"
      }
    },
    "dependencies": {
      "type": "object",
      "description": "Runtime dependencies for this package.",
      "additionalProperties": {
        "type": "string",
        "description": "Version range or specifier (e.g., '^1.0.0', 'msr:@std/assert@^1.0.0')"
      }
    },
    "devDependencies": {
      "type": "object",
      "description": "Development dependencies for this package.",
      "additionalProperties": {
        "type": "string",
        "description": "Version range or specifier (e.g., '^1.0.0', 'msr:@std/testing@^1.0.0')"
      }
    },
    "peerDependencies": {
      "type": "object",
      "description": "Peer dependencies for this package.",
      "additionalProperties": {
        "type": "string"
      }
    },
    "optionalDependencies": {
      "type": "object",
      "description": "Optional dependencies for this package.",
      "additionalProperties": {
        "type": "string"
      }
    },
    "tasks": {
      "description": "Configuration for musi task",
      "type": "object",
      "patternProperties": {
        "^[A-Za-z][A-Za-z0-9_\\-:]*$": {
          "oneOf": [
            {
              "type": "string",
              "description": "Command to execute for this task name."
            },
            {
              "type": "object",
              "description": "A definition of a task to execute",
              "properties": {
                "description": {
                  "type": "string",
                  "description": "Description of a task that will be shown when running `musi task` without a task name"
                },
                "command": {
                  "type": "string",
                  "description": "The task to execute"
                },
                "dependencies": {
                  "type": "array",
                  "items": {
                    "type": "string"
                  },
                  "description": "Tasks that should be executed before this task"
                }
              }
            }
          ]
        }
      },
      "additionalProperties": false
    },
    "bin": {
      "oneOf": [
        {
          "type": "string",
          "description": "Path to executable file.",
          "pattern": "^\\./.*\\.ms$"
        },
        {
          "type": "object",
          "description": "Map of command names to executable files.",
          "additionalProperties": {
            "type": "string",
            "pattern": "^\\./.*\\.ms$"
          }
        }
      ]
    },
    "files": {
      "type": "array",
      "description": "List of files, directories or globs to include when publishing.",
      "items": {
        "type": "string"
      }
    },
    "keywords": {
      "type": "array",
      "description": "Keywords for package discovery.",
      "items": {
        "type": "string"
      }
    },
    "author": {
      "oneOf": [
        {
          "type": "string",
          "description": "Author name and email (e.g., 'Name <email@example.com>')."
        },
        {
          "type": "object",
          "properties": {
            "name": {
              "type": "string"
            },
            "email": {
              "type": "string"
            },
            "url": {
              "type": "string"
            }
          }
        }
      ]
    },
    "license": {
      "type": "string",
      "description": "The SPDX license identifier for this package."
    },
    "homepage": {
      "type": "string",
      "description": "URL to the package homepage."
    },
    "repository": {
      "oneOf": [
        {
          "type": "string",
          "description": "Repository URL or shorthand (e.g., 'github:user/repo')."
        },
        {
          "type": "object",
          "properties": {
            "type": {
              "type": "string",
              "default": "git"
            },
            "url": {
              "type": "string"
            },
            "directory": {
              "type": "string"
            }
          }
        }
      ]
    },
    "bugs": {
      "oneOf": [
        {
          "type": "string",
          "description": "URL to bug tracker."
        },
        {
          "type": "object",
          "properties": {
            "url": {
              "type": "string"
            },
            "email": {
              "type": "string"
            }
          }
        }
      ]
    },
    "private": {
      "type": "boolean",
      "description": "Whether this package is private (not published).",
      "default": false
    },
    "workspaces": {
      "oneOf": [
        {
          "type": "array",
          "items": {
            "type": "string"
          },
          "description": "Workspace member paths."
        },
        {
          "type": "object",
          "properties": {
            "packages": {
              "type": "array",
              "items": {
                "type": "string"
              }
            }
          }
        }
      ]
    },
    "publishRegistry": {
      "type": "string",
      "description": "Registry URL for publishing this package.",
      "default": "https://msr.musi-lang.org"
    },
    "exclude": {
      "type": "array",
      "description": "List of files, directories or globs that will be ignored by all other configurations.",
      "items": {
        "type": "string"
      }
    },
    "fmt": {
      "description": "Configuration for formatter",
      "type": "object",
      "properties": {
        "include": {
          "type": "array",
          "description": "List of files, directories or globs that will be formatted.",
          "items": {
            "type": "string"
          }
        },
        "exclude": {
          "type": "array",
          "description": "List of files, directories or globs that will not be formatted.",
          "items": {
            "type": "string"
          }
        },
        "useTabs": {
          "description": "Whether to use tabs (true) or spaces (false) for indentation.",
          "type": "boolean",
          "default": false
        },
        "lineWidth": {
          "description": "The width of a line the printer will try to stay under.",
          "type": "number",
          "default": 80
        },
        "indentWidth": {
          "description": "The number of characters for an indent.",
          "type": "number",
          "default": 2
        },
        "semiColons": {
          "description": "Whether to prefer using semicolons.",
          "type": "boolean",
          "default": true
        },
        "proseWrap": {
          "description": "Define how prose should be wrapped in Markdown files.",
          "default": "preserve",
          "enum": [
            "always",
            "never",
            "preserve"
          ]
        }
      }
    },
    "lint": {
      "description": "Configuration for linter",
      "type": "object",
      "properties": {
        "include": {
          "type": "array",
          "description": "List of files, directories or globs that will be linted.",
          "items": {
            "type": "string"
          }
        },
        "exclude": {
          "type": "array",
          "description": "List of files, directories or globs that will not be linted.",
          "items": {
            "type": "string"
          }
        },
        "rules": {
          "type": "object",
          "properties": {
            "tags": {
              "type": "array",
              "description": "List of tag names that will be run.",
              "items": {
                "type": "string"
              },
              "examples": [
                [
                  "recommended"
                ],
                [
                  "all"
                ]
              ]
            },
            "exclude": {
              "type": "array",
              "description": "List of rule names to exclude.",
              "items": {
                "type": "string"
              }
            },
            "include": {
              "type": "array",
              "description": "List of rule names to include.",
              "items": {
                "type": "string"
              }
            }
          }
        }
      }
    },
    "test": {
      "description": "Configuration for musi test",
      "type": "object",
      "properties": {
        "include": {
          "type": "array",
          "description": "List of files, directories or globs that will be searched for tests.",
          "items": {
            "type": "string"
          }
        },
        "exclude": {
          "type": "array",
          "description": "List of files, directories or globs that will not be searched for tests.",
          "items": {
            "type": "string"
          }
        }
      }
    },
    "bench": {
      "description": "Configuration for musi bench",
      "type": "object",
      "properties": {
        "include": {
          "type": "array",
          "description": "List of files, directories or globs that will be searched for benchmarks.",
          "items": {
            "type": "string"
          }
        },
        "exclude": {
          "type": "array",
          "description": "List of files, directories or globs that will not be searched for benchmarks.",
          "items": {
            "type": "string"
          }
        }
      }
    },
    "publish": {
      "description": "Configuration for musi publish",
      "type": "object",
      "properties": {
        "include": {
          "type": "array",
          "description": "List of files, directories or globs that will be included in the published package.",
          "items": {
            "type": "string"
          }
        },
        "exclude": {
          "type": "array",
          "description": "List of files, directories or globs that will be excluded from the published package.",
          "items": {
            "type": "string"
          }
        }
      }
    },
    "depsDir": {
      "oneOf": [
        {
          "description": "Sets the deps directory management mode for packages.",
          "default": "auto",
          "enum": [
            "auto",
            "manual",
            "none"
          ]
        },
        {
          "description": "Enables or disables the use of a local deps folder for packages.",
          "type": "boolean"
        }
      ]
    },
    "vendor": {
      "description": "Enables or disables the use of a local vendor folder as a local cache for remote modules.",
      "type": "boolean",
      "default": false
    },
    "lock": {
      "description": "Whether to use a lock file or the path to use for the lock file.",
      "oneOf": [
        {
          "type": "boolean"
        },
        {
          "type": "string"
        },
        {
          "type": "object",
          "properties": {
            "path": {
              "type": "string",
              "description": "The path to use for the lock file.",
              "default": "musi.lock"
            },
            "frozen": {
              "type": "boolean",
              "description": "Whether to exit with an error if lock file is out of date.",
              "default": false
            }
          }
        }
      ],
      "default": true
    }
  }
}
