{
	"$schema": "https://raw.githubusercontent.com/musi-lang/musi/refs/heads/main/schemas/mspackage-schema.v1.json",
	"name": "higher-order",
	"version": "0.1.0",
	"description": "Higher-order functions, lambdas, and generics with array operations.",
	"keywords": ["higher-order", "lambdas", "generics", "functional"],
	"license": "MIT",
	"main": "./index.ms",
	"tasks": {
		"run": "../../target/release/musi run ./index.ms",
		"check": "../../target/release/musi check ./index.ms"
	}
}
